{
  "id": "game:dynasty-warriors-8",
  "display_name": "Dynasty Warriors 8",
  "aliases": [
    "DW8",
    "Shin Sangokumusou 7"
  ],
  "series_id": "series:dynasty-warriors",
  "release_year": 2013,
  "platforms": [
    "playstation",
    "xbox",
    "pc",
    "nintendo"
  ],
  "player_modes": [
    "single_player",
    "local_co_op",
    "online_co_op"
  ],
  "max_local_players": 2,
  "max_online_players": 2,
  "developer": "Omega Force",
  "publisher": "Tecmo Koei",
  "has_character_creation": false,
  "spoiler_sensitive": true,
  "summary": {
    "blocks": [
      {
        "spoiler_level": "none",
        "text": "Adds branching story paths that let a kingdom's campaign diverge from the historical outcome, plus a weapon affinity system.",
        "language": "en"
      },
      {
        "spoiler_level": "major",
        "text": "Hypothetical routes unlock by meeting in-battle conditions and can keep officers alive who die on the historical path.",
        "language": "en",
        "scope_game_ids": [
          "game:dynasty-warriors-8"
        ]
      }
    ]
  },
  "tags": [
    "branching-routes",
    "weapon-affinity"
  ],
  "provenance": {
    "category": "community_observation",
    "contributor": "musoudb_seed",
    "contributed_at": "2026-08-03T00:00:00Z",
    "sources": [
      {
        "kind": "in_game_observation",
        "citation": "Verified by a contributor during play; see revision history."
      }
    ]
  },
  "meta": {
    "schema_version": "0",
    "revision": 1,
    "created_at": "2026-08-03T00:00:00Z",
    "updated_at": "2026-08-03T00:00:00Z",
    "status": "accepted"
  }
}
