{
  "id": "game:dynasty-warriors-3",
  "display_name": "Dynasty Warriors 3",
  "aliases": [
    "DW3",
    "Shin Sangokumusou 2"
  ],
  "series_id": "series:dynasty-warriors",
  "release_year": 2001,
  "regional_titles": [
    {
      "region": "jp",
      "title": "Shin Sangokumusou 2"
    },
    {
      "region": "na",
      "title": "Dynasty Warriors 3"
    }
  ],
  "platforms": [
    "playstation",
    "xbox",
    "pc"
  ],
  "player_modes": [
    "single_player",
    "local_co_op"
  ],
  "max_local_players": 2,
  "developer": "Omega Force",
  "publisher": "KOEI",
  "has_character_creation": false,
  "spoiler_sensitive": false,
  "summary": {
    "blocks": [
      {
        "spoiler_level": "none",
        "text": "The entry that established the series template many later games refined: a large roster, Musou Mode campaigns per officer, and Free Mode replays of any unlocked stage.",
        "language": "en"
      }
    ]
  },
  "tags": [
    "ps2-era",
    "series-defining"
  ],
  "provenance": {
    "category": "community_observation",
    "contributor": "musoudb_seed",
    "contributed_at": "2026-08-03T00:00:00Z",
    "sources": [
      {
        "kind": "in_game_observation",
        "citation": "Verified by a contributor during play; see revision history."
      }
    ]
  },
  "meta": {
    "schema_version": "0",
    "revision": 1,
    "created_at": "2026-08-03T00:00:00Z",
    "updated_at": "2026-08-03T00:00:00Z",
    "status": "accepted"
  }
}
